"Paper Title","Paper Link","Publication Year","Publication Type","Publication Title","Author Names","DOI","PDF Link","Abstract","TL;DR"
"Consistency of SVDQuartets and Maximum Likelihood for Coalescent-based Species Tree Estimation","https://scispace.com/paper/consistency-of-svdquartets-and-maximum-likelihood-for-2lj40ksr31","2020","Posted Content","bioRxiv","Matthew Wascher
Laura Kubatko","10.1101/523050","https://scispace.com/pdf/consistency-of-svdquartets-and-maximum-likelihood-for-2lj40ksr31.pdf","Numerous methods for inferring species-level phylogenies under the coalescent model have been proposed within the last 20 years, and debates continue about the relative strengths and weaknesses of these methods. One desirable property of a phylogenetic estimator is that of statistical consistency, which means intuitively that as more data are collected, the probability that the estimated tree has the same topology as the true tree goes to 1. To date, consistency results for species tree inference under the multispecies coalescent have been derived only for summary statistics methods, such as ASTRAL and MP-EST. These methods have been found to be consistent given true gene trees, but may be inconsistent when gene trees are estimated from data for loci of finite length (Roch et al., 2019). Here we consider the question of statistical consistency for four taxa for SVDQuartets for general data types, as well as for the maximum likelihood (ML) method in the case in which the data are a collection of sites generated under the multispecies coalescent model such that the sites are conditionally independent given the species tree (we call these data Coalescent Independent Sites (CIS) data). We show that SVDQuartets is statistically consistent for all data types (i.e., for both CIS data and for multilocus data), and we derive its rate of convergence. We additionally show that ML is consistent for CIS data under the JC69 model, and discuss why a proof for the more general multilocus case is difficult. Finally, we compare the performance of maximum likelihood and SDVQuartets using simulation for both data types.","It is shown that SVDQuartets is statistically consistent for all data types, and ML is consistent for CIS data under the JC69 model, and it is discussed why a proof for the more general multilocus case is difficult."
"Reply to Gatesy and Springer: The multispecies coalescent model can effectively handle recombination and gene tree heterogeneity","https://scispace.com/paper/reply-to-gatesy-and-springer-the-multispecies-coalescent-4gdpiak7dv","2013","Journal Article","Proceedings of the National Academy of Sciences of the United States of America","Shaoyuan Wu
Sen Song
Liang Liu
Scott V. Edwards","10.1073/PNAS.1300129110","https://scispace.com/pdf/reply-to-gatesy-and-springer-the-multispecies-coalescent-4gdpiak7dv.pdf","Gatesy and Springer (1) suggest that coalescent methods cannot build a reliable phylogeny from gene trees, particularly from exonic sequences concatenated in silico. However, the authors confuse several key issues in coalescent theory and phylogenetic reconstruction, and their criticisms are unfounded.","It is suggested that coalescent methods cannot build a reliable phylogeny from gene trees, particularly from exonic sequences concatenated in silico, and criticisms are unfounded."
"Likelihood-based tests of species tree hypotheses.","https://scispace.com/paper/likelihood-based-tests-of-species-tree-hypotheses-3q2vjpmr","2023","Journal Article","Molecular Biology and Evolution","Richard Adams
Michael DeGiorgio","10.1093/molbev/msad159","","Likelihood-based tests of phylogenetic trees are a foundation of modern systematics. Over the past decade, an enormous wealth and diversity of model-based approaches have been developed for phylogenetic inference of both gene trees and species trees. However, while many techniques exist for conducting formal likelihood-based tests of gene trees, such frameworks are comparatively underdeveloped and underutilized for testing species tree hypotheses. To date, widely-used tests of tree topology are designed to assess the fit of classical models of molecular sequence data and individual gene trees, and thus, are not readily applicable to the problem of species tree inference. To address this issue, we derive several analogous likelihood-based approaches for testing topologies using modern species tree models and heuristic algorithms that use gene tree topologies as input for maximum likelihood estimation under the multispecies coalescent. For the purpose of comparing support for species trees, these tests leverage the statistical procedures of their original gene tree-based counterparts that have an extended history for testing phylogenetic hypotheses at a single locus. We discuss and demonstrate a number of applications, limitations, and important considerations of these tests using simulated and empirical phylogenomic datasets that include both bifurcating topologies and reticulate network models of species relationships. Finally, we introduce the open-source R package SpeciesTopoTestR (Species  Topology Tests in R) that includes a suite of functions for conducting formal likelihood-based tests of species topologies given a set of input gene tree topologies.","In this article , the authors derive several analogous likelihood-based approaches for testing topologies using modern species tree models and heuristic algorithms that use gene tree topologies as input for maximum likelihood estimation under the multispecies coalescent."
"Large-scale species tree estimation","https://scispace.com/paper/large-scale-species-tree-estimation-4rxd0kn84e","2019","Posted Content","arXiv: Populations and Evolution","Erin K. Molloy
Tandy Warnow","","https://arxiv.org/pdf/1904.02600.pdf","Species tree estimation is a complex problem, due to the fact that different parts of the genome can have different evolutionary histories than the genome itself. One of the causes for this discord is incomplete lineage sorting (also called deep coalescence), which is a population-level process that produces gene trees that differ from the species tree. The last decade has seen a large number of new methods developed to estimate species trees from multi-locus datasets, specifically addressing this cause of gene tree heterogeneity. In this paper, we review these methods, focusing mainly on issues that relate to analyses of datasets containing large numbers of species or loci (or both). We also discuss divide-and-conquer strategies for enabling species tree estimation methods to run on large datasets, including new approaches that are based on algorithms (such as TreeMerge) for the Disjoint Tree Merger problem.","This paper discusses divide-and-conquer strategies for enabling species tree estimation methods to run on large datasets, including new approaches that are based on algorithms (such as TreeMerge) for the Disjoint Tree Merger problem."
"Impact of long-term chromosomal shuffling on the multispecies coalescent analysis of two anthropoid primate lineages.","https://scispace.com/paper/impact-of-long-term-chromosomal-shuffling-on-the-9ykn2qqlcw","2018","Journal Article","Ecology and Evolution","Carlos G. Schrago
Beatriz Mello
Anieli G. Pereira
Carolina Furtado
Héctor N. Seuánez","10.1002/ECE3.3736","","Multispecies coalescent (MSC) theory assumes that gene trees inferred from individual loci are independent trials of the MSC process. As genes might be physically close in syntenic associations spanning along chromosome regions, these assumptions might be flawed in evolutionary lineages with substantial karyotypic shuffling. Neotropical primates (NP) represent an ideal case for assessing the performance of MSC methods in such scenarios because chromosome diploid number varies significantly in this lineage. To this end, we investigated the effect of sequence length on the theoretical expectations of MSC model, as well as the results of coalescent-based tree inference methods. This was carried out by comparing NP with hominids, a lineage in which chromosome macrostructure has been stable for at least 15 million years. We found that departure from the MSC model in Neotropical primates decreased with smaller sequence fragments, where sites sharing the same evolutionary history were more frequently found than in longer fragments. This scenario probably resulted from extensive karyotypic rearrangement occurring during the radiation of NP, contrary to the comparatively stable chromosome evolution in hominids.","It was found that departure from the MSC model in Neotropical primates decreased with smaller sequence fragments, where sites sharing the same evolutionary history were more frequently found than in longer fragments."
"Bayesian Inference of Reticulate Phylogenies under the Multispecies Network Coalescent","https://scispace.com/paper/bayesian-inference-of-reticulate-phylogenies-under-the-3szigeygqj","2016","Journal Article","PLOS Genetics","Dingqiao Wen
Yun Yu
Luay Nakhleh","10.1371/JOURNAL.PGEN.1006006","https://scispace.com/pdf/bayesian-inference-of-reticulate-phylogenies-under-the-3szigeygqj.pdf","The multispecies coalescent (MSC) is a statistical framework that models how gene genealogies grow within the branches of a species tree. The field of computational phylogenetics has witnessed an explosion in the development of methods for species tree inference under MSC, owing mainly to the accumulating evidence of incomplete lineage sorting in phylogenomic analyses. However, the evolutionary history of a set of genomes, or species, could be reticulate due to the occurrence of evolutionary processes such as hybridization or horizontal gene transfer. We report on a novel method for Bayesian inference of genome and species phylogenies under the multispecies network coalescent (MSNC). This framework models gene evolution within the branches of a phylogenetic network, thus incorporating reticulate evolutionary processes, such as hybridization, in addition to incomplete lineage sorting. As phylogenetic networks with different numbers of reticulation events correspond to points of different dimensions in the space of models, we devise a reversible-jump Markov chain Monte Carlo (RJMCMC) technique for sampling the posterior distribution of phylogenetic networks under MSNC. We implemented the methods in the publicly available, open-source software package PhyloNet and studied their performance on simulated and biological data. The work extends the reach of Bayesian inference to phylogenetic networks and enables new evolutionary analyses that account for reticulation.","A novel method for Bayesian inference of genome and species phylogenies under the multispecies network coalescent (MSNC) is reported on, thus incorporating reticulate evolutionary processes, such as hybridization, in addition to incomplete lineage sorting."
"The Multispecies Coalescent in Space and Time","https://scispace.com/paper/the-multispecies-coalescent-in-space-and-time-3z2aiuiat3","2020","Posted Content","bioRxiv","Patrick F. McKenzie
Deren A. R. Eaton","10.1101/2020.08.02.233395","https://www.biorxiv.org/content/biorxiv/early/2020/08/03/2020.08.02.233395.full.pdf","A key distinction between species tree inference under the multi-species coalescent model (MSC), and the inference of gene trees in sliding windows along a genome, is in the effect of genetic linkage. Whereas the MSC explicitly assumes genealogies to be unlinked, i.e., statistically independent, genealogies located close together on genomes are spatially auto-correlated. Here we use tree sequence simulations with recombination to explore the effects of species tree parameters on spatial patterns of linkage among genealogies. We decompose coalescent time units to demonstrate differential effects of generation time and effective population size on spatial coalescent patterns, and we define a new metric, ""phylogenetic linkage,"" for measuring the rate of decay of phylogenetic similarity by comparison to distances among unlinked genealogies. Finally, we provide a simple example where accounting for phylogenetic linkage in sliding window analyses improves local gene tree inference.","A new metric, “phylogenetic linkage,” is defined for measuring the rate of decay of phylogenetic similarity by comparison to distances among unlinked genealogies, and a simple example where accounting for phylogenetic linkage in sliding window analyses improves local gene tree inference is provided."
"Challenges in species tree estimation under the multispecies coalescent model","https://scispace.com/paper/challenges-in-species-tree-estimation-under-the-multispecies-37vjh1ic6f","2016","Journal Article","Genetics","Bo Xu
Ziheng Yang
Ziheng Yang","10.1534/GENETICS.116.190173","https://www.genetics.org/content/genetics/204/4/1353.full.pdf","The multispecies coalescent (MSC) model has emerged as a powerful framework for inferring species phylogenies while accounting for ancestral polymorphism and gene tree-species tree conflict. A number of methods have been developed in the past few years to estimate the species tree under the MSC. The full likelihood methods (including maximum likelihood and Bayesian inference) average over the unknown gene trees and accommodate their uncertainties properly but involve intensive computation. The approximate or summary coalescent methods are computationally fast and are applicable to genomic datasets with thousands of loci, but do not make an efficient use of information in the multilocus data. Most of them take the two-step approach of reconstructing the gene trees for multiple loci by phylogenetic methods and then treating the estimated gene trees as observed data, without accounting for their uncertainties appropriately. In this article we review the statistical nature of the species tree estimation problem under the MSC, and explore the conceptual issues and challenges of species tree estimation by focusing mainly on simple cases of three or four closely related species. We use mathematical analysis and computer simulation to demonstrate that large differences in statistical performance may exist between the two classes of methods. We illustrate that several counterintuitive behaviors may occur with the summary methods but they are due to inefficient use of information in the data by summary methods and vanish when the data are analyzed using full-likelihood methods. These include (i) unidentifiability of parameters in the model, (ii) inconsistency in the so-called anomaly zone, (iii) singularity on the likelihood surface, and (iv) deterioration of performance upon addition of more data. We discuss the challenges and strategies of species tree inference for distantly related species when the molecular clock is violated, and highlight the need for improving the computational efficiency and model realism of the likelihood methods as well as the statistical efficiency of the summary methods.","The challenges and strategies of species tree inference for distantly related species when the molecular clock is violated are discussed, and the need for improving the computational efficiency and model realism of the likelihood methods as well as the statistical efficiency of the summary methods is highlighted."
"Impact of Ghost Introgression on Coalescent-Based Species Tree Inference and Estimation of Divergence Time","https://scispace.com/paper/impact-of-ghost-introgression-on-coalescent-based-species-1x8h6zz6","2022","Journal Article","Systematic Biology","","10.1093/sysbio/syac047","https://scispace.com/pdf/impact-of-ghost-introgression-on-coalescent-based-species-1x8h6zz6.pdf","The species studied in any evolutionary investigation generally constitute a small proportion of all the species currently existing or that have gone extinct. It is therefore likely that introgression, which is widespread across the tree of life, involves ""ghosts,"" that is, unsampled, unknown, or extinct lineages. However, the impact of ghost introgression on estimations of species trees has rarely been studied and is poorly understood. Here, we use mathematical analysis and simulations to examine the robustness of species tree methods based on the multispecies coalescent model to introgression from a ghost or extant lineage. We found that many results originally obtained for introgression between extant species can easily be extended to ghost introgression, such as the strongly interactive effects of incomplete lineage sorting (ILS) and introgression on the occurrence of anomalous gene trees. The relative performance of the summary species tree method (ASTRAL) and the full-likelihood method (*BEAST) varies under different introgression scenarios, with the former being more robust to gene flow between nonsister species, whereas the latter performing better under certain conditions of ghost introgression. When an outgroup ghost (defined as a lineage that diverged before the most basal species under investigation) acts as the donor of the introgressed genes, the time of root divergence among the investigated species generally was overestimated, whereas ingroup introgression, as commonly perceived, can only lead to underestimation. In many cases of ingroup introgression that may or may not involve ghost lineages, the stronger the ILS, the higher the accuracy achieved in estimating the time of root divergence, although the topology of the species tree is more prone to be biased by the effect of introgression. [Anomalous gene trees; divergence time; ghost introgression; multispecies coalescent; simulation; species tree.]. ","In this paper , the authors use mathematical analysis and simulations to examine the robustness of species tree methods based on the multispecies coalescent model to introgression from a ghost or extant lineage."
"Additional file 1 of The performance of coalescent-based species tree estimation methods under models of missing data","https://scispace.com/paper/additional-file-1-of-the-performance-of-coalescent-based-uuxri8xj7hfy","2018","Journal Article","","Nute, Michael
Molloy, Erin
Tandy Warnow","10.6084/m9.figshare.6234098","","Supplementary Materials. Detailed methods and commands for tree estimation and evaluation. Eight (8) figures and three (3) tables describing additional results, including those for simulated datasets when species trees were simulated with recent speciation. (PDF 489 kb) ",""
"Additional file 1 of The performance of coalescent-based species tree estimation methods under models of missing data","https://scispace.com/paper/additional-file-1-of-the-performance-of-coalescent-based-u1fbtvupy299","2018","Journal Article","","Nute, Michael
Molloy, Erin
Tandy Warnow","10.6084/m9.figshare.6234098.v1","","Supplementary Materials. Detailed methods and commands for tree estimation and evaluation. Eight (8) figures and three (3) tables describing additional results, including those for simulated datasets when species trees were simulated with recent speciation. (PDF 489 kb) ",""
"Special Issue “Primate Phylogeny and Genetics”","https://scispace.com/paper/special-issue-primate-phylogeny-and-genetics-xtbltrmo5y","2024","Journal Article","Genes","Ute Radespiel
Christian Roos","10.3390/genes15010068","","New phylogenetic tools and population genetics methods have been developed and vastly advanced over the last decade [...]","New phylogenetic and population genetics methods have been developed and advanced for primates."
"Robustness to Divergence Time Underestimation When Inferring Species Trees from Estimated Gene Trees","https://scispace.com/paper/robustness-to-divergence-time-underestimation-when-inferring-1enal7w5vb","2014","Journal Article","Systematic Biology","Michael DeGiorgio
James H. Degnan","10.1093/SYSBIO/SYT059","https://scispace.com/pdf/robustness-to-divergence-time-underestimation-when-inferring-1enal7w5vb.pdf","To infer species trees from gene trees estimated from phylogenomic data sets, tractable methods are needed that can handle dozens to hundreds of loci. We examine several computationally efficient approaches—MP-EST, STAR, STEAC, STELLS, and STEM—for inferring species trees from gene trees estimated using maximum likelihood (ML) and Bayesian approaches. Among the methods examined, we found that topology-based methods often performed better using ML gene trees and methods employing coalescent times typically performed better using Bayesian gene trees, with MP- EST, STAR, STEAC, and STELLS outperforming STEM under most conditions. We examine why the STEM tree (also called GLASS or Maximum Tree) is less accurate on estimated gene trees by comparing estimated and true coalescence times, performing species tree inference using simulations, and analyzing a great ape data set keeping track of false positive and false negative rates for inferred clades. We find that although true coalescence times are more ancient than speciation times under the multispecies coalescent model, estimated coalescence times are often more recent than speciation times. This underestimation can lead to increased bias and lack of resolution with increased sampling (either alleles or loci) when gene trees are estimated with ML. The problem appears to be less severe using Bayesian gene-tree estimates. (Bayesian; false negative; false positive; gene tree; maximum likelihood; phylogenetics; Robinson-Foulds; statistical consistency.)","This work examines several computationally efficient approaches-MP-EST, STAR, STEAC, STELLS, and STEM-for inferring species trees from gene trees estimated using maximum likelihood (ML) and Bayesian approaches and finds that topology-based methods often performed better using ML gene trees and methods employing coalescent times typically performed better with Bayesian gene trees."
"Scalable Species Tree Inference with External Constraints","https://scispace.com/paper/scalable-species-tree-inference-with-external-constraints-3whv6gfrbi","2021","Posted Content","bioRxiv","Baqiao Liu
Tandy Warnow","10.1101/2021.11.05.467436","https://www.biorxiv.org/content/biorxiv/early/2021/11/05/2021.11.05.467436.full.pdf","Species tree inference under the multi-species coalescent (MSC) model is a basic step in biological discovery. Despite the developments in recent years of methods that are proven statistically consistent and that have high accuracy, large datasets create computational challenges. Although there is gener- ally some information available about the species trees that could be used to speed up the estimation, only one method, ASTRAL-J, a recent development in the ASTRAL family of methods, is able to use this information. Here we describe two new methods, NJst-J and FASTRAL-J, that can estimate the species tree given partial knowledge of the species tree in the form of a non-binary unrooted constraint tree.. We show that both NJst-J and FASTRAL-J are much faster than ASTRAL-J and we prove that all three methods are statistically consistent under the multi-species coalescent model subject to this constraint. Our extensive simulation study shows that both FASTRAL-J and NJst-J provide advantages over ASTRAL-J: both are faster (and NJst-J is particularly fast), and FASTRAL-J is generally at least as accurate as ASTRAL-J. An analysis of the Avian Phylogenomics project dataset with 48 species and 14,446 genes presents additional evidence of the value of FASTRAL-J over ASTRAL-J (and both over ASTRAL), with dramatic reductions in running time (20 hours for default ASTRAL, and minutes or seconds for ASTRAL-J and FASTRAL-J, respectively). Availability: FASTRAL-J and NJst-J are available in open source form at https://github.com/ RuneBlaze/FASTRAL-constrained and https://github.com/RuneBlaze/NJst-constrained. Locations of the datasets used in this study and detailed commands needed to reproduce the study are provided in the supplementary materials at http://tandy.cs.illinois.edu/baqiao-suppl.pdf.","In this article, the authors proposed two new methods, NJst-J and FASTRAL-J, that can estimate the species tree given partial knowledge of the species trees in the form of a non-binary unrooted constraint tree."
